{
  "schema_version": "1.0",
  "heartbeat_id": "heartbeat_20260904_144500_001",
  "request_id": "req_dddddddddddddddddddddddddddddddd",
  "node_id": "node-shanghai-001",
  "account_id": "acct_primary_001",
  "boot_id": "boot_11111111111111111111111111111111",
  "heartbeat_seq": 172,
  "trade_date": "2026-09-04",
  "sent_at": "2026-09-04T14:45:00+08:00",
  "execution_mode": "SHADOW",
  "runtime_state": "AUTO",
  "connectivity": {
    "qmt": "CONNECTED",
    "broker_account": "OK",
    "central_api": "REACHABLE",
    "market_data": "HEALTHY"
  },
  "health": {
    "journal": "HEALTHY",
    "event_queue_depth": 3,
    "event_queue_capacity": 10000,
    "writer_queue_depth": 1,
    "writer_queue_capacity": 2000,
    "outbox_pending": 0,
    "oldest_outbox_at": null,
    "active_orders": 2,
    "subscribed_symbols": 15,
    "wal_bytes": 1048576,
    "disk_free_bytes": 53687091200,
    "clock_offset_ms": 12
  },
  "versions": {
    "runtime": "0.1.0.dev4",
    "config_hash": "sha256:aaaaaaaaaaaaaaaaaaaaaaaaaaaaaaaaaaaaaaaaaaaaaaaaaaaaaaaaaaaaaaaa",
    "python": "3.11.9",
    "qmt": "broker-build-pending-poc",
    "xtquant": "bundled-version-pending-poc"
  },
  "last_reconciliation_id": "recon_20260904_143000_001",
  "degraded_reasons": []
}
